{
  "id": "financial-stress-and-your-health",
  "alt": "The Hidden Health Cost of Financial Stress — And What to Do About It",
  "credit": "Source image referenced in article metadata",
  "sourceUrl": "https://images.unsplash.com/photo-1554224155-6726b3ff858f?w=1200&auto=format&fit=crop&q=80",
  "usage": "hero"
}
