{
  "id": "zone-2-training-longevity",
  "alt": "Zone 2 Training: The Most Underrated Longevity Exercise You're Probably Skipping",
  "credit": "Source image referenced in article metadata",
  "sourceUrl": "https://images.unsplash.com/photo-1571008887538-b36bb32f4571?w=1200&auto=format&fit=crop&q=80",
  "usage": "hero"
}
