{
  "id": "shinrin-yoku-forest-bathing",
  "alt": "Shinrin-Yoku: The Japanese Science of Forest Bathing and Why It Works",
  "credit": "Source image referenced in article metadata",
  "sourceUrl": "https://images.unsplash.com/photo-1448375240586-882707db888b?w=1200&auto=format&fit=crop&q=80",
  "usage": "hero"
}
