{
  "id": "meditation-changes-your-brain",
  "alt": "Eight Weeks of Meditation Literally Reshapes Your Brain — The Neuroscience",
  "credit": "Source image referenced in article metadata",
  "sourceUrl": "https://images.unsplash.com/photo-1506126613408-eca07ce68773?w=1200&auto=format&fit=crop&q=80",
  "usage": "hero"
}
