{
  "id": "social-connection-longevity-science",
  "alt": "Loneliness Is as Deadly as Smoking 15 Cigarettes a Day — Here's the Science",
  "credit": "Source image referenced in article metadata",
  "sourceUrl": "https://images.unsplash.com/photo-1529156069898-49953e39b3ac?w=1200&auto=format&fit=crop&q=80",
  "usage": "hero"
}
